{
  "accepted": [
    "ffffffffffffffffffffffffffffffffffffffffffffffffffffffffffffffff"
  ],
  "unverifiable": [],
  "rejected_counts": {
    "agent-wrote-id": 1,
    "out-of-range": 2
  },
  "scope_sha256": "2222222222222222222222222222222222222222222222222222222222222222",
  "claimed_sha256": "3333333333333333333333333333333333333333333333333333333333333333"
}
